{
  "schemaVersion": 1,
  "documentId": "monthly-specials",
  "revision": 1,
  "updatedAt": "2026-07-22T00:15:42.881Z",
  "updatedBy": "phase-1-current-live-migration",
  "page": {
    "size": "legal",
    "orientation": "portrait",
    "widthPx": 816,
    "heightPx": 1344,
    "pdfWidthPt": 612,
    "pdfHeightPt": 1008,
    "maxActiveSpecials": 4
  },
  "theme": {
    "accentColor": "#c92b32",
    "accentRgb": "201, 43, 50"
  },
  "header": {
    "brandMark": {
      "assetId": "asset_brand_marks_2c744d7e0d1f",
      "visible": true,
      "alt": "Paragon Purveyors brand mark",
      "fit": "contain",
      "zoom": 1,
      "focusX": 50,
      "focusY": 50
    },
    "wordmark": {
      "assetId": "asset_wordmarks_74146895287a",
      "visible": true,
      "alt": "Paragon Purveyors wordmark",
      "fit": "contain",
      "zoom": 1,
      "focusX": 50,
      "focusY": 50
    },
    "deliveryMessage": {
      "value": "NO MINIMUM REQUIRED FOR FREE DELIVERY",
      "visible": true
    },
    "campaignMark": {
      "assetId": "asset_campaign_marks_4f2c6075d73d",
      "visible": false,
      "alt": "FIFA World Cup 2026 campaign mark",
      "fit": "contain",
      "zoom": 1,
      "focusX": 50,
      "focusY": 50
    },
    "campaignTitle": {
      "line1": "Selected",
      "line2": "Cuts",
      "visible": true
    },
    "month": {
      "value": "September",
      "visible": true
    },
    "year": {
      "value": "2026",
      "visible": true
    },
    "supportingLine": {
      "value": "",
      "visible": false
    }
  },
  "specials": [
    {
      "id": "tenderloin",
      "sort": 1,
      "active": true,
      "offerMode": "dual-offer",
      "displayName": "Tenderloin / Filet Mignon",
      "brand": "Black Opal",
      "brandLogo": {
        "assetId": "asset_product_brand_logos_f3813ec833cd",
        "visible": true,
        "alt": "Black Opal logo",
        "fit": "contain",
        "zoom": 1,
        "focusX": 50,
        "focusY": 50
      },
      "productLine": "Australian Wagyu",
      "marblingScore": "MB 4-5",
      "quantityAvailable": "Available",
      "primaryOffer": {
        "label": "2-Pack / 8+ oz each",
        "price": 60,
        "image": {
          "assetId": "asset_tenderloin_436ae92089e2",
          "visible": true,
          "alt": "Black Opal Filet Mignon steak",
          "fit": "cover",
          "zoom": 1.91,
          "focusX": 47,
          "focusY": 48
        }
      },
      "savingsMessage": "Buy 5 get an extra steak for free (P.O)",
      "description": "Lean, tender, and refined. A classic center-plate cut for elegant preparations.",
      "secondaryOffer": {
        "label": "Tenderloin AVG 5.5+ lb",
        "price": 260,
        "image": {
          "assetId": "asset_tenderloin_e3602dbdc4f2",
          "visible": true,
          "alt": "Black Opal whole Tenderloin cut",
          "fit": "cover",
          "zoom": 1.5,
          "focusX": 57,
          "focusY": 46
        }
      }
    },
    {
      "id": "ribeye",
      "sort": 2,
      "active": true,
      "offerMode": "dual-offer",
      "displayName": "Cube Roll / Rib Eye",
      "brand": "Black Opal",
      "brandLogo": {
        "assetId": "asset_product_brand_logos_f3813ec833cd",
        "visible": true,
        "alt": "Black Opal logo",
        "fit": "contain",
        "zoom": 1,
        "focusX": 50,
        "focusY": 50
      },
      "productLine": "Australian Wagyu",
      "marblingScore": "MB 6-7",
      "quantityAvailable": "Available",
      "primaryOffer": {
        "label": "12+ oz steak",
        "price": 36,
        "image": {
          "assetId": "asset_ribeye_c2b28238aeca",
          "visible": true,
          "alt": "Black Opal Rib Eye steak",
          "fit": "cover",
          "zoom": 1.39,
          "focusX": 46,
          "focusY": 49
        }
      },
      "savingsMessage": "Buy 5 get an extra steak for free (P.O)",
      "description": "Richly marbled with full beef flavor. Built for a bold, memorable steak experience.",
      "secondaryOffer": {
        "label": "Cube Roll AVG 13+ lb",
        "price": 460,
        "image": {
          "assetId": "asset_ribeye_8be297e0f5cf",
          "visible": true,
          "alt": "Black Opal whole Cube Roll cut",
          "fit": "contain",
          "zoom": 1.21,
          "focusX": 61,
          "focusY": 47
        }
      }
    },
    {
      "id": "striploin",
      "sort": 3,
      "active": true,
      "offerMode": "dual-offer",
      "displayName": "Striploin / NY Strip",
      "brand": "Black Opal",
      "brandLogo": {
        "assetId": "asset_product_brand_logos_f3813ec833cd",
        "visible": true,
        "alt": "Black Opal logo",
        "fit": "contain",
        "zoom": 1,
        "focusX": 50,
        "focusY": 50
      },
      "productLine": "Australian Wagyu",
      "marblingScore": "MB 8-9",
      "quantityAvailable": "Available",
      "primaryOffer": {
        "label": "12+ oz steak",
        "price": 35,
        "image": {
          "assetId": "asset_striploin_ad97428e172c",
          "visible": true,
          "alt": "Black Opal New York Strip steak",
          "fit": "contain",
          "zoom": 2.5,
          "focusX": 57,
          "focusY": 57
        }
      },
      "savingsMessage": "Buy 5 get an extra steak for free (P.O)",
      "description": "Classic steakhouse cut with a clean bite, rich flavor, and refined texture.",
      "secondaryOffer": {
        "label": "Primal AVG 14+ lb",
        "price": 450,
        "image": {
          "assetId": "asset_striploin_1afd3bb1e8d5",
          "visible": true,
          "alt": "Black Opal whole Striploin cut",
          "fit": "contain",
          "zoom": 1.19,
          "focusX": 100,
          "focusY": 45
        }
      }
    },
    {
      "id": "tri-tip",
      "sort": 4,
      "active": true,
      "offerMode": "single-offer",
      "displayName": "Tri Tip Roast",
      "brand": "Altair",
      "brandLogo": {
        "assetId": "asset_product_brand_logos_6711aac99f54",
        "visible": true,
        "alt": "Altair logo",
        "fit": "contain",
        "zoom": 1,
        "focusX": 50,
        "focusY": 50
      },
      "productLine": "Australian Wagyu",
      "marblingScore": "MB 5+",
      "quantityAvailable": "Available",
      "primaryOffer": {
        "label": "2-Pack / 5 lb",
        "price": 95,
        "image": {
          "assetId": "asset_tri_tip_75fc925ebbd0",
          "visible": true,
          "alt": "Altair Wagyu Tri Tip roast",
          "fit": "contain",
          "zoom": 1.88,
          "focusX": 48,
          "focusY": 53
        }
      },
      "savingsMessage": "Each Pack is 2.5 lb (P.O)",
      "description": "Versatile and deeply savory, with a distinctive shape and satisfying texture."
    }
  ],
  "contacts": {
    "instruction": "To place an order, contact the representative closest to your area.",
    "items": [
      {
        "id": "blake",
        "sort": 1,
        "active": true,
        "name": "Blake B.",
        "location": "Irvine / Orange County",
        "phone": "(949) 303-9726",
        "email": "blake@paragonpurveyors.com"
      },
      {
        "id": "clayton",
        "sort": 2,
        "active": true,
        "name": "Clayton U.",
        "location": "French Valley / Temecula",
        "phone": "(951) 414-5230",
        "email": "clay@paragonpurveyors.com"
      }
    ]
  },
  "footer": {
    "message": "For wholesale pricing/availability reach out to Blake or Clay directly.",
    "disclaimer": "Pricing and availability are subject to change.",
    "buttonLabel": "Paragon Purveyors",
    "url": "https://paragonpurveyors.com",
    "broll": {
      "assetId": "asset_footer_18603beddba5",
      "visible": true,
      "alt": "Paragon Purveyors editorial Wagyu preparation",
      "fit": "cover",
      "zoom": 1,
      "focusX": 50,
      "focusY": 100,
      "opacity": 1,
      "saturation": 0.82,
      "contrast": 1.02,
      "brightness": 0.88
    }
  },
  "assetLibrary": {
    "asset_brand_marks_2c744d7e0d1f": {
      "id": "asset_brand_marks_2c744d7e0d1f",
      "label": "Paragon Purveyors Brand Mark",
      "category": "brand-mark",
      "library": "brand-marks",
      "path": "assets/specials/library/brand-marks/paragon-purveyors-brand-mark-2c744d7e0d1f.svg",
      "mimeType": "image/svg+xml",
      "sha256": "2c744d7e0d1f1e9020ef90cb98c6aaba1fe3f1b64f8525984d2d48a3f235d46e",
      "bytes": 5305,
      "width": 375,
      "height": 461,
      "createdAt": "2026-07-22T00:15:42.881Z",
      "archived": false
    },
    "asset_wordmarks_74146895287a": {
      "id": "asset_wordmarks_74146895287a",
      "label": "Paragon Purveyors Wordmark",
      "category": "wordmark",
      "library": "wordmarks",
      "path": "assets/specials/library/wordmarks/paragon-purveyors-wordmark-74146895287a.svg",
      "mimeType": "image/svg+xml",
      "sha256": "74146895287a6112970c65ef415056c174ed41d6c16fc1ee2d4af086301c4bb4",
      "bytes": 11771,
      "width": 375,
      "height": 135,
      "createdAt": "2026-07-22T00:15:42.881Z",
      "archived": false
    },
    "asset_campaign_marks_4f2c6075d73d": {
      "id": "asset_campaign_marks_4f2c6075d73d",
      "label": "World Cup 2026 Campaign Mark",
      "category": "campaign-mark",
      "library": "campaign-marks",
      "path": "assets/specials/library/campaign-marks/world-cup-2026-campaign-mark-4f2c6075d73d.png",
      "mimeType": "image/png",
      "sha256": "4f2c6075d73d8f5bc498b1250c39a3c5e4fdd3ca09d063595ff4bd4f101b75c0",
      "bytes": 287928,
      "width": 1500,
      "height": 1500,
      "createdAt": "2026-07-22T00:15:42.881Z",
      "archived": false
    },
    "asset_product_brand_logos_f3813ec833cd": {
      "id": "asset_product_brand_logos_f3813ec833cd",
      "label": "Black Opal Logo",
      "category": "product-brand-logo",
      "library": "product-brand-logos",